{
  "$schema": "ai_docs/workflows/hiring/schemas/takehome_evaluation.schema.json",
  "candidate_id": "nova_002_donghyun_kim",
  "candidate_name": "Donghyun Kim",
  "github_url": "https://github.com/dh0304/BitMex-Binance-REST-API",
  "commit_short": "8e531e9",
  "criteria": [
    {
      "name": "Requirements Coverage",
      "score": 6.0,
      "comments": [
        "Core domain validations exist (e.g., trading instrument expiry rules).",
        "Unit tests cover positive/negative price and quantity validations.",
        "No end-to-end or contract/API tests found."
      ],
      "evidence": [
        {"path": "src/domain/trading_instrument.py", "line_start": 20, "line_end": 25, "commit_short": "8e531e9", "note": "Expiry rules validated in __post_init__"},
        {"path": "test/validate/test_order_validator.py", "line_start": 12, "line_end": 31, "commit_short": "8e531e9", "note": "Parametrized tests for price validation"},
        {"path": "test/validate/test_order_validator.py", "line_start": 38, "line_end": 56, "commit_short": "8e531e9", "note": "Parametrized tests for quantity validation"}
      ]
    },
    {
      "name": "Code Quality",
      "score": 6.0,
      "comments": [
        "Clear validation functions with explicit exceptions for invalid inputs.",
        "Domain modeling via dataclasses improves readability.",
        "No CI/linting config detected to enforce quality gates."
      ],
      "evidence": [
        {"path": "src/validate/order_validator.py", "line_start": 6, "line_end": 12, "commit_short": "8e531e9", "note": "Explicit ValueError on non-positive price/quantity"},
        {"path": "src/domain/trading_instrument.py", "line_start": 12, "line_end": 18, "commit_short": "8e531e9", "note": "Domain dataclass for trading instrument"}
      ]
    },
    {
      "name": "Architecture & Scalability",
      "score": 6.0,
      "comments": [
        "Layered domain structure with typed entities and validation.",
        "No evidence of DI or service boundaries; limited extensibility patterns."
      ],
      "evidence": [
        {"path": "src/domain/trading_instrument.py", "line_start": 12, "line_end": 26, "commit_short": "8e531e9", "note": "Domain modeling + invariant checks"}
      ]
    },
    {
      "name": "Correctness & Testing",
      "score": 5.5,
      "comments": [
        "Parameterized unit tests for validation logic are present.",
        "No integration/contract tests or CI pipeline detected."
      ],
      "evidence": [
        {"path": "test/validate/test_order_validator.py", "line_start": 12, "line_end": 31, "commit_short": "8e531e9", "note": "Positive/negative price tests"},
        {"path": "test/validate/test_order_validator.py", "line_start": 38, "line_end": 56, "commit_short": "8e531e9", "note": "Positive/negative quantity tests"}
      ]
    },
    {
      "name": "Performance & Efficiency",
      "score": 3.5,
      "comments": [
        "No explicit timeouts/retries/caching or perf tests found.",
        "No load or benchmarking evidence."
      ],
      "evidence": []
    },
    {
      "name": "Security & Compliance",
      "score": 5.5,
      "comments": [
        "Pydantic ConfigDict for Decimal JSON encoding shows validation/serialization discipline.",
        "No secret management or dependency scanning evidence."
      ],
      "evidence": [
        {"path": "src/dto/shared_config.py", "line_start": 6, "line_end": 10, "commit_short": "8e531e9", "note": "DECIMAL_CONFIG using Pydantic ConfigDict"}
      ]
    },
    {
      "name": "Documentation & DX",
      "score": 6.0,
      "comments": [
        "README provides setup and structure overview.",
        "Missing OpenAPI/Swagger and containerization instructions."
      ],
      "evidence": [
        {"path": "README.md", "line_start": 1, "line_end": 50, "commit_short": "8e531e9", "note": "Setup and project structure"}
      ]
    },
    {
      "name": "Observability",
      "score": 2.5,
      "comments": [
        "No structured logging/metrics/tracing found.",
        "No health checks or diagnostics."
      ],
      "evidence": []
    }
  ],
  "overall_recommendation": "No Hire",
  "security_checklist": {
    "secrets_not_committed": null,
    "dependency_risks_reviewed": null,
    "input_validation_present": true,
    "error_handling_robust": null,
    "licenses_compliant": null
  },
  "observability_checklist": {
    "structured_logging": false,
    "metrics_health": false,
    "timeouts_retries": false,
    "alerting_diagnostics": false
  },
  "notes": "Agent-first, code-first evidence updated with concrete file:line @ 8e531e9."
}